10:51:32.659205 IP 172.16.5.18.2152 > 172.16.7.248.2152: UDP, length 60
10:51:32.684318 IP 172.16.7.248.2152 > 172.16.5.18.2152: UDP, length 48
10:51:33.034278 IP 172.16.7.248.2152 > 172.16.5.18.2152: UDP, length 238
10:51:33.077336 IP 172.16.5.18.2152 > 172.16.7.248.2152: UDP, length 749
10:51:33.077364 IP 172.16.5.18.2152 > 172.16.7.248.2152: UDP, length 78
10:51:33.104266 IP 172.16.7.248.2152 > 172.16.5.18.2152: UDP, length 67
10:51:33.114280 IP 172.16.7.248.2152 > 172.16.5.18.2152: UDP, length 67
10:51:34.485562 IP 172.16.5.18.2152 > 172.16.7.248.2152: UDP, length 60
10:51:34.524320 IP 172.16.7.248.2152 > 172.16.5.18.2152: UDP, length 48
10:51:35.180023 IP 172.16.5.18.bootpc > 172.16.5.2.bootps: BOOTP/DHCP, Request from fa:16:3e:0c:4b:bd (oui Unknown), length 300
10:51:35.182591 IP 172.16.5.2.bootps > 172.16.5.61.bootpc: BOOTP/DHCP, Reply, length 350
10:51:35.296864 IP 172.16.5.18.2152 > 172.16.7.248.2152: UDP, length 133
10:51:35.324319 IP 172.16.7.248.2152 > 172.16.5.18.2152: UDP, length 48
10:51:36.514234 IP 172.16.7.248.2152 > 172.16.5.18.2152: UDP, length 238
10:51:36.597064 IP 172.16.5.18.2152 > 172.16.7.248.2152: UDP, length 748
10:51:36.597097 IP 172.16.5.18.2152 > 172.16.7.248.2152: UDP, length 78
10:51:36.634230 IP 172.16.7.248.2152 > 172.16.5.18.2152: UDP, length 246
10:51:36.634292 IP 172.16.7.248.2152 > 172.16.5.18.2152: UDP, length 67
10:51:36.634293 IP 172.16.7.248.2152 > 172.16.5.18.2152: UDP, length 67
10:51:36.664231 IP 172.16.7.248.2152 > 172.16.5.18.2152: UDP, length 68
10:51:36.729536 IP 172.16.5.18.2152 > 172.16.7.248.2152: UDP, length 80
10:51:36.761676 IP 172.16.5.18.2152 > 172.16.7.248.2152: UDP, length 68
10:51:36.804276 IP 172.16.7.248.2152 > 172.16.5.18.2152: UDP, length 60
10:51:36.814248 IP 172.16.7.248.2152 > 172.16.5.18.2152: UDP, length 596
10:51:36.824299 IP 172.16.7.248.2152 > 172.16.5.18.2152: UDP, length 1176
10:51:36.824642 IP 172.16.5.18.55321 > 172.16.5.31.sip: SIP: INVITE sip:7003@172.16.5.31 SIP/2.0
10:51:36.826441 IP 172.16.5.31.sip > 172.16.5.18.55321: SIP: SIP/2.0 401 Unauthorized
10:51:36.826720 IP 172.16.5.18.2152 > 172.16.7.248.2152: UDP, length 543
10:51:36.904204 IP 172.16.5.18.2152 > 172.16.7.248.2152: UDP, length 60
10:51:36.904788 IP 172.16.5.18.2152 > 172.16.7.248.2152: UDP, length 263
10:51:36.944252 IP 172.16.7.248.2152 > 172.16.5.18.2152: UDP, length 60
10:51:36.954224 IP 172.16.7.248.2152 > 172.16.5.18.2152: UDP, length 124
10:51:37.033838 IP 172.16.5.18.2152 > 172.16.7.248.2152: UDP, length 60
10:51:37.074254 IP 172.16.7.248.2152 > 172.16.5.18.2152: UDP, length 438
10:51:37.147134 IP 172.16.5.18.2152 > 172.16.7.248.2152: UDP, length 60
10:51:37.147614 IP 172.16.5.18.2152 > 172.16.7.248.2152: UDP, length 595
10:51:37.154534 IP 172.16.5.18.2152 > 172.16.7.248.2152: UDP, length 144
10:51:37.154560 IP 172.16.5.18.2152 > 172.16.7.248.2152: UDP, length 94
10:51:37.164366 IP 172.16.7.248.2152 > 172.16.5.18.2152: UDP, length 349
10:51:37.164412 IP 172.16.5.18.55321 > 172.16.5.31.sip: SIP: ACK sip:7003@172.16.5.31 SIP/2.0
10:51:37.174280 IP 172.16.7.248.2152 > 172.16.5.18.2152: UDP, length 1341
10:51:37.174319 IP 172.16.5.18.55321 > 172.16.5.31.sip: SIP: INVITE sip:7003@172.16.5.31 SIP/2.0
10:51:37.184298 IP 172.16.7.248.2152 > 172.16.5.18.2152: UDP, length 60
10:51:37.185969 IP 172.16.5.31.sip > 172.16.5.18.55321: SIP: SIP/2.0 100 Trying
10:51:37.186010 IP 172.16.5.18.2152 > 172.16.7.248.2152: UDP, length 484
10:51:37.187143 IP 172.16.5.31.sip > 172.16.5.18.55321: SIP: SIP/2.0 200 OK
10:51:37.187180 IP 172.16.5.18.2152 > 172.16.7.248.2152: UDP, length 803
10:51:37.224236 IP 172.16.7.248.2152 > 172.16.5.18.2152: UDP, length 60
10:51:37.344288 IP 172.16.7.248.2152 > 172.16.5.18.2152: UDP, length 56
10:51:37.344289 IP 172.16.7.248.2152 > 172.16.5.18.2152: UDP, length 56
10:51:37.344372 IP 172.16.5.18.49503 > 172.16.5.31.11636: UDP, length 20
10:51:37.344404 IP 172.16.5.18.34808 > 172.16.5.31.11637: UDP, length 20
10:51:37.345108 IP 172.16.5.31.11637 > 172.16.5.18.34808: UDP, length 32
10:51:37.345109 IP 172.16.5.31.11637 > 172.16.5.18.34808: UDP, length 24
10:51:37.345158 IP 172.16.5.18.2152 > 172.16.7.248.2152: UDP, length 68
10:51:37.345184 IP 172.16.5.18.2152 > 172.16.7.248.2152: UDP, length 60
10:51:37.345197 IP 172.16.5.31.11636 > 172.16.5.18.49503: UDP, length 32
10:51:37.345198 IP 172.16.5.31.11636 > 172.16.5.18.49503: UDP, length 24
10:51:37.345213 IP 172.16.5.18.2152 > 172.16.7.248.2152: UDP, length 68
10:51:37.345224 IP 172.16.5.18.2152 > 172.16.7.248.2152: UDP, length 60
10:51:37.444302 IP 172.16.7.248.2152 > 172.16.5.18.2152: UDP, length 56
10:51:37.444303 IP 172.16.7.248.2152 > 172.16.5.18.2152: UDP, length 56
10:51:37.444349 IP 172.16.5.18.49503 > 172.16.5.31.11636: UDP, length 20
10:51:37.444370 IP 172.16.5.18.34808 > 172.16.5.31.11637: UDP, length 20
10:51:37.444912 IP 172.16.5.31.11637 > 172.16.5.18.34808: UDP, length 32
10:51:37.444952 IP 172.16.5.18.2152 > 172.16.7.248.2152: UDP, length 68
10:51:37.444991 IP 172.16.5.31.11637 > 172.16.5.18.34808: UDP, length 24
10:51:37.445005 IP 172.16.5.18.2152 > 172.16.7.248.2152: UDP, length 60
10:51:37.445020 IP 172.16.5.31.11636 > 172.16.5.18.49503: UDP, length 32
10:51:37.445021 IP 172.16.5.31.11636 > 172.16.5.18.49503: UDP, length 24
10:51:37.445035 IP 172.16.5.18.2152 > 172.16.7.248.2152: UDP, length 68
10:51:37.445050 IP 172.16.5.18.2152 > 172.16.7.248.2152: UDP, length 60
10:51:37.454276 IP 172.16.7.248.2152 > 172.16.5.18.2152: UDP, length 532
10:51:37.454319 IP 172.16.5.18.55321 > 172.16.5.31.sip: SIP: ACK sip:7003@172.16.5.31:5060 SIP/2.0
10:51:37.697441 IP 172.16.5.31.sip > 172.16.5.18.49284: SIP: INVITE sip:7003@172.16.5.18:49284;transport=udp SIP/2.0
10:51:37.697486 IP 172.16.5.18.2152 > 172.16.7.248.2152: UDP, length 934
10:51:37.796793 IP 172.16.5.31.sip > 172.16.5.18.49284: SIP: INVITE sip:7003@172.16.5.18:49284;transport=udp SIP/2.0
10:51:37.796885 IP 172.16.5.18.2152 > 172.16.7.248.2152: UDP, length 934
10:51:37.814228 IP 172.16.7.248.2152 > 172.16.5.18.2152: UDP, length 287
10:51:37.814279 IP 172.16.5.18.49284 > 172.16.5.31.sip: SIP: SIP/2.0 100 Trying
10:51:37.894405 IP 172.16.7.248.2152 > 172.16.5.18.2152: UDP, length 441
10:51:37.894472 IP 172.16.5.18.49284 > 172.16.5.31.sip: SIP: SIP/2.0 180 Ringing
10:51:37.894514 IP 172.16.7.248.2152 > 172.16.5.18.2152: UDP, length 441
10:51:37.894543 IP 172.16.5.18.49284 > 172.16.5.31.sip: SIP: SIP/2.0 180 Ringing
10:51:37.924338 IP 172.16.7.248.2152 > 172.16.5.18.2152: UDP, length 56
10:51:37.924436 IP 172.16.5.18.34808 > 172.16.5.31.11637: UDP, length 20
10:51:37.925088 IP 172.16.5.31.11637 > 172.16.5.18.34808: UDP, length 32
10:51:37.925089 IP 172.16.5.31.11637 > 172.16.5.18.34808: UDP, length 24
10:51:37.925139 IP 172.16.5.18.2152 > 172.16.7.248.2152: UDP, length 68
10:51:37.925166 IP 172.16.5.18.2152 > 172.16.7.248.2152: UDP, length 60
10:51:38.414229 IP 172.16.7.248.2152 > 172.16.5.18.2152: UDP, length 56
10:51:38.414291 IP 172.16.5.18.34808 > 172.16.5.31.11637: UDP, length 20
10:51:38.414869 IP 172.16.5.31.11637 > 172.16.5.18.34808: UDP, length 32
10:51:38.414870 IP 172.16.5.31.11637 > 172.16.5.18.34808: UDP, length 24
10:51:38.414910 IP 172.16.5.18.2152 > 172.16.7.248.2152: UDP, length 68
10:51:38.414931 IP 172.16.5.18.2152 > 172.16.7.248.2152: UDP, length 60
10:51:38.914302 IP 172.16.7.248.2152 > 172.16.5.18.2152: UDP, length 56
10:51:38.914368 IP 172.16.5.18.34808 > 172.16.5.31.11637: UDP, length 20
10:51:38.914970 IP 172.16.5.31.11637 > 172.16.5.18.34808: UDP, length 32
10:51:38.914971 IP 172.16.5.31.11637 > 172.16.5.18.34808: UDP, length 24
10:51:38.915017 IP 172.16.5.18.2152 > 172.16.7.248.2152: UDP, length 68
10:51:38.915043 IP 172.16.5.18.2152 > 172.16.7.248.2152: UDP, length 60
10:51:39.354279 IP 172.16.7.248.2152 > 172.16.5.18.2152: UDP, length 56
10:51:39.354371 IP 172.16.5.18.49503 > 172.16.5.31.11636: UDP, length 20
10:51:39.354725 IP 172.16.5.31.11636 > 172.16.5.18.49503: UDP, length 32
10:51:39.354773 IP 172.16.5.18.2152 > 172.16.7.248.2152: UDP, length 68
10:51:39.354794 IP 172.16.5.31.11636 > 172.16.5.18.49503: UDP, length 24
10:51:39.354808 IP 172.16.5.18.2152 > 172.16.7.248.2152: UDP, length 60
10:51:39.434234 IP 172.16.7.248.2152 > 172.16.5.18.2152: UDP, length 56
10:51:39.434279 IP 172.16.5.18.34808 > 172.16.5.31.11637: UDP, length 20
10:51:39.434849 IP 172.16.5.31.11637 > 172.16.5.18.34808: UDP, length 32
10:51:39.434850 IP 172.16.5.31.11637 > 172.16.5.18.34808: UDP, length 24
10:51:39.434894 IP 172.16.5.18.2152 > 172.16.7.248.2152: UDP, length 68
10:51:39.434923 IP 172.16.5.18.2152 > 172.16.7.248.2152: UDP, length 60
10:51:39.854247 IP 172.16.7.248.2152 > 172.16.5.18.2152: UDP, length 56
10:51:39.854303 IP 172.16.5.18.49503 > 172.16.5.31.11636: UDP, length 20
10:51:39.854843 IP 172.16.5.31.11636 > 172.16.5.18.49503: UDP, length 32
10:51:39.854844 IP 172.16.5.31.11636 > 172.16.5.18.49503: UDP, length 24
10:51:39.854887 IP 172.16.5.18.2152 > 172.16.7.248.2152: UDP, length 68
10:51:39.854910 IP 172.16.5.18.2152 > 172.16.7.248.2152: UDP, length 60
10:51:39.914266 IP 172.16.7.248.2152 > 172.16.5.18.2152: UDP, length 56
10:51:39.914306 IP 172.16.5.18.34808 > 172.16.5.31.11637: UDP, length 20
10:51:39.914879 IP 172.16.5.31.11637 > 172.16.5.18.34808: UDP, length 32
10:51:39.914880 IP 172.16.5.31.11637 > 172.16.5.18.34808: UDP, length 24
10:51:39.914909 IP 172.16.5.18.2152 > 172.16.7.248.2152: UDP, length 68
10:51:39.914929 IP 172.16.5.18.2152 > 172.16.7.248.2152: UDP, length 60
10:51:40.284373 IP 172.16.7.248.2152 > 172.16.5.18.2152: UDP, length 826
10:51:40.284374 IP 172.16.7.248.2152 > 172.16.5.18.2152: UDP, length 56
10:51:40.284374 IP 172.16.7.248.2152 > 172.16.5.18.2152: UDP, length 56
10:51:40.284438 IP 172.16.5.18.49284 > 172.16.5.31.sip: SIP: SIP/2.0 200 Ok
10:51:40.284474 IP 172.16.5.18.34827 > 172.16.5.31.19188: UDP, length 20
10:51:40.284506 IP 172.16.5.18.54341 > 172.16.5.31.19189: UDP, length 20
10:51:40.285029 IP 172.16.5.31.19189 > 172.16.5.18.54341: UDP, length 32
10:51:40.285030 IP 172.16.5.31.19189 > 172.16.5.18.54341: UDP, length 24
10:51:40.285068 IP 172.16.5.18.2152 > 172.16.7.248.2152: UDP, length 68
10:51:40.285088 IP 172.16.5.18.2152 > 172.16.7.248.2152: UDP, length 60
10:51:40.285099 IP 172.16.5.31.19188 > 172.16.5.18.34827: UDP, length 32
10:51:40.285100 IP 172.16.5.31.19188 > 172.16.5.18.34827: UDP, length 24
10:51:40.285112 IP 172.16.5.18.2152 > 172.16.7.248.2152: UDP, length 68
10:51:40.285121 IP 172.16.5.18.2152 > 172.16.7.248.2152: UDP, length 60
10:51:40.285892 IP 172.16.5.31.sip > 172.16.5.18.49284: SIP: ACK sip:172.16.5.18:49284;transport=udp SIP/2.0
10:51:40.285957 IP 172.16.5.18.2152 > 172.16.7.248.2152: UDP, length 447
10:51:40.289315 IP 172.16.5.31.sip > 172.16.5.18.55321: SIP: INVITE sip:7001@172.16.5.18:55321;transport=udp SIP/2.0
10:51:40.289356 IP 172.16.5.18.2152 > 172.16.7.248.2152: UDP, length 812
10:51:40.289410 IP 172.16.5.31.sip > 172.16.5.18.49284: SIP: INVITE sip:172.16.5.18:49284;transport=udp SIP/2.0
10:51:40.289446 IP 172.16.5.18.2152 > 172.16.7.248.2152: UDP, length 908
10:51:40.354238 IP 172.16.7.248.2152 > 172.16.5.18.2152: UDP, length 56
10:51:40.354279 IP 172.16.5.18.49503 > 172.16.5.31.11636: UDP, length 20
10:51:40.354848 IP 172.16.5.31.11636 > 172.16.5.18.49503: UDP, length 32
10:51:40.354888 IP 172.16.5.18.2152 > 172.16.7.248.2152: UDP, length 68
10:51:40.354904 IP 172.16.5.31.11636 > 172.16.5.18.49503: UDP, length 24
10:51:40.354916 IP 172.16.5.18.2152 > 172.16.7.248.2152: UDP, length 60
10:51:40.364262 IP 172.16.7.248.2152 > 172.16.5.18.2152: UDP, length 248
10:51:40.364301 IP 172.16.5.18.55321 > 172.16.5.31.sip: SIP: SIP/2.0 100 Trying
10:51:40.389255 IP 172.16.5.31.sip > 172.16.5.18.49284: SIP: INVITE sip:172.16.5.18:49284;transport=udp SIP/2.0
10:51:40.389318 IP 172.16.5.18.2152 > 172.16.7.248.2152: UDP, length 908
10:51:40.409312 IP 172.16.7.248.2152 > 172.16.5.18.2152: UDP, length 760
10:51:40.409350 IP 172.16.5.18.55321 > 172.16.5.31.sip: SIP: SIP/2.0 200 Ok
10:51:40.410356 IP 172.16.5.31.sip > 172.16.5.18.55321: SIP: ACK sip:7001@172.16.5.18:55321;transport=udp SIP/2.0
10:51:40.410396 IP 172.16.5.18.2152 > 172.16.7.248.2152: UDP, length 399
10:51:40.434215 IP 172.16.7.248.2152 > 172.16.5.18.2152: UDP, length 56
10:51:40.434714 IP 172.16.5.18.2152 > 172.16.7.248.2152: UDP, length 56
10:51:40.464262 IP 172.16.7.248.2152 > 172.16.5.18.2152: UDP, length 84
10:51:40.464697 IP 172.16.5.18.2152 > 172.16.7.248.2152: UDP, length 84
10:51:40.484320 IP 172.16.7.248.2152 > 172.16.5.18.2152: UDP, length 56
10:51:40.484360 IP 172.16.5.18.34827 > 172.16.5.31.19188: UDP, length 20
10:51:40.485818 IP 172.16.5.31.19188 > 172.16.5.18.34827: UDP, length 32
10:51:40.485819 IP 172.16.5.31.19188 > 172.16.5.18.34827: UDP, length 24
10:51:40.485859 IP 172.16.5.18.2152 > 172.16.7.248.2152: UDP, length 68
10:51:40.485884 IP 172.16.5.18.2152 > 172.16.7.248.2152: UDP, length 60
10:51:40.494268 IP 172.16.7.248.2152 > 172.16.5.18.2152: UDP, length 56
10:51:40.494309 IP 172.16.5.18.54341 > 172.16.5.31.19189: UDP, length 20
10:51:40.494890 IP 172.16.5.18.2152 > 172.16.7.248.2152: UDP, length 84
10:51:40.534249 IP 172.16.7.248.2152 > 172.16.5.18.2152: UDP, length 299
10:51:40.534289 IP 172.16.5.18.49284 > 172.16.5.31.sip: SIP: SIP/2.0 100 Trying
10:51:40.544334 IP 172.16.7.248.2152 > 172.16.5.18.2152: UDP, length 826
10:51:40.544375 IP 172.16.5.18.49284 > 172.16.5.31.sip: SIP: SIP/2.0 200 Ok
10:51:40.545403 IP 172.16.5.31.sip > 172.16.5.18.49284: SIP: ACK sip:172.16.5.18:49284;transport=udp SIP/2.0
10:51:40.545441 IP 172.16.5.18.2152 > 172.16.7.248.2152: UDP, length 447
10:51:40.554284 IP 172.16.7.248.2152 > 172.16.5.18.2152: UDP, length 208
10:51:40.594283 IP 172.16.7.248.2152 > 172.16.5.18.2152: UDP, length 208
10:51:40.594284 IP 172.16.7.248.2152 > 172.16.5.18.2152: UDP, length 208
10:51:40.609357 IP 172.16.7.248.2152 > 172.16.5.18.2152: UDP, length 208
10:51:40.654321 IP 172.16.7.248.2152 > 172.16.5.18.2152: UDP, length 208
10:51:40.654322 IP 172.16.7.248.2152 > 172.16.5.18.2152: UDP, length 208
10:51:40.669374 IP 172.16.7.248.2152 > 172.16.5.18.2152: UDP, length 208
10:51:40.714286 IP 172.16.7.248.2152 > 172.16.5.18.2152: UDP, length 208
10:51:40.714287 IP 172.16.7.248.2152 > 172.16.5.18.2152: UDP, length 208
10:51:40.729358 IP 172.16.7.248.2152 > 172.16.5.18.2152: UDP, length 208
10:51:40.734234 IP 172.16.7.248.2152 > 172.16.5.18.2152: UDP, length 56
10:51:40.734337 IP 172.16.5.18.2152 > 172.16.7.248.2152: UDP, length 56
10:51:40.744298 IP 172.16.7.248.2152 > 172.16.5.18.2152: UDP, length 56
10:51:40.744351 IP 172.16.5.18.2152 > 172.16.7.248.2152: UDP, length 56
10:51:40.774243 IP 172.16.7.248.2152 > 172.16.5.18.2152: UDP, length 208
10:51:40.774244 IP 172.16.7.248.2152 > 172.16.5.18.2152: UDP, length 208
10:51:40.774245 IP 172.16.7.248.2152 > 172.16.5.18.2152: UDP, length 84
10:51:40.774345 IP 172.16.5.18.2152 > 172.16.7.248.2152: UDP, length 84
10:51:40.814281 IP 172.16.7.248.2152 > 172.16.5.18.2152: UDP, length 208
10:51:40.814343 IP 172.16.7.248.2152 > 172.16.5.18.2152: UDP, length 208
10:51:40.829275 IP 172.16.7.248.2152 > 172.16.5.18.2152: UDP, length 208
10:51:40.854248 IP 172.16.7.248.2152 > 172.16.5.18.2152: UDP, length 56
10:51:40.854312 IP 172.16.5.18.2152 > 172.16.7.248.2152: UDP, length 84
10:51:40.854346 IP 172.16.5.18.2152 > 172.16.7.248.2152: UDP, length 56
10:51:40.864242 IP 172.16.7.248.2152 > 172.16.5.18.2152: UDP, length 56
10:51:40.864291 IP 172.16.5.18.2152 > 172.16.7.248.2152: UDP, length 56
10:51:40.874317 IP 172.16.7.248.2152 > 172.16.5.18.2152: UDP, length 208
10:51:40.879347 IP 172.16.7.248.2152 > 172.16.5.18.2152: UDP, length 208
10:51:40.904226 IP 172.16.7.248.2152 > 172.16.5.18.2152: UDP, length 208
10:51:40.904228 IP 172.16.7.248.2152 > 172.16.5.18.2152: UDP, length 84
10:51:40.904321 IP 172.16.5.18.2152 > 172.16.7.248.2152: UDP, length 84
10:51:40.914283 IP 172.16.7.248.2152 > 172.16.5.18.2152: UDP, length 208
10:51:40.954251 IP 172.16.7.248.2152 > 172.16.5.18.2152: UDP, length 208
10:51:40.954252 IP 172.16.7.248.2152 > 172.16.5.18.2152: UDP, length 208
10:51:40.994258 IP 172.16.7.248.2152 > 172.16.5.18.2152: UDP, length 208
10:51:40.994259 IP 172.16.7.248.2152 > 172.16.5.18.2152: UDP, length 56
10:51:40.994260 IP 172.16.7.248.2152 > 172.16.5.18.2152: UDP, length 208
10:51:41.034252 IP 172.16.7.248.2152 > 172.16.5.18.2152: UDP, length 208
10:51:41.034253 IP 172.16.7.248.2152 > 172.16.5.18.2152: UDP, length 208
10:51:41.074254 IP 172.16.7.248.2152 > 172.16.5.18.2152: UDP, length 208
10:51:41.074255 IP 172.16.7.248.2152 > 172.16.5.18.2152: UDP, length 208
10:51:41.114237 IP 172.16.7.248.2152 > 172.16.5.18.2152: UDP, length 208
10:51:41.114238 IP 172.16.7.248.2152 > 172.16.5.18.2152: UDP, length 208
10:51:41.154250 IP 172.16.7.248.2152 > 172.16.5.18.2152: UDP, length 208
10:51:41.154251 IP 172.16.7.248.2152 > 172.16.5.18.2152: UDP, length 208
10:51:41.194236 IP 172.16.7.248.2152 > 172.16.5.18.2152: UDP, length 208
10:51:41.194238 IP 172.16.7.248.2152 > 172.16.5.18.2152: UDP, length 208
10:51:41.234229 IP 172.16.7.248.2152 > 172.16.5.18.2152: UDP, length 208
10:51:41.234231 IP 172.16.7.248.2152 > 172.16.5.18.2152: UDP, length 208
10:51:41.274258 IP 172.16.7.248.2152 > 172.16.5.18.2152: UDP, length 208
10:51:41.274260 IP 172.16.7.248.2152 > 172.16.5.18.2152: UDP, length 208
10:51:41.314235 IP 172.16.7.248.2152 > 172.16.5.18.2152: UDP, length 208
10:51:41.314237 IP 172.16.7.248.2152 > 172.16.5.18.2152: UDP, length 208
10:51:41.354255 IP 172.16.7.248.2152 > 172.16.5.18.2152: UDP, length 208
10:51:41.354256 IP 172.16.7.248.2152 > 172.16.5.18.2152: UDP, length 208
10:51:41.374254 IP 172.16.7.248.2152 > 172.16.5.18.2152: UDP, length 56
10:51:41.374326 IP 172.16.5.18.2152 > 172.16.7.248.2152: UDP, length 84
10:51:41.374355 IP 172.16.5.18.2152 > 172.16.7.248.2152: UDP, length 56
10:51:41.384343 IP 172.16.7.248.2152 > 172.16.5.18.2152: UDP, length 56
10:51:41.384393 IP 172.16.5.18.2152 > 172.16.7.248.2152: UDP, length 56
10:51:41.394262 IP 172.16.7.248.2152 > 172.16.5.18.2152: UDP, length 208
10:51:41.394263 IP 172.16.7.248.2152 > 172.16.5.18.2152: UDP, length 208
10:51:41.434303 IP 172.16.7.248.2152 > 172.16.5.18.2152: UDP, length 208
10:51:41.434304 IP 172.16.7.248.2152 > 172.16.5.18.2152: UDP, length 84
10:51:41.434387 IP 172.16.5.18.2152 > 172.16.7.248.2152: UDP, length 84
10:51:41.439414 IP 172.16.7.248.2152 > 172.16.5.18.2152: UDP, length 208
10:51:41.464252 IP 172.16.7.248.2152 > 172.16.5.18.2152: UDP, length 208
10:51:41.474256 IP 172.16.7.248.2152 > 172.16.5.18.2152: UDP, length 208
10:51:41.484244 IP 172.16.7.248.2152 > 172.16.5.18.2152: UDP, length 56
10:51:41.494220 IP 172.16.7.248.2152 > 172.16.5.18.2152: UDP, length 208
10:51:41.534274 IP 172.16.7.248.2152 > 172.16.5.18.2152: UDP, length 208
10:51:41.534276 IP 172.16.7.248.2152 > 172.16.5.18.2152: UDP, length 208
10:51:41.574252 IP 172.16.7.248.2152 > 172.16.5.18.2152: UDP, length 208
10:51:41.574253 IP 172.16.7.248.2152 > 172.16.5.18.2152: UDP, length 208
10:51:41.614248 IP 172.16.7.248.2152 > 172.16.5.18.2152: UDP, length 208
10:51:41.614250 IP 172.16.7.248.2152 > 172.16.5.18.2152: UDP, length 208
10:51:41.654211 IP 172.16.7.248.2152 > 172.16.5.18.2152: UDP, length 208
10:51:41.654213 IP 172.16.7.248.2152 > 172.16.5.18.2152: UDP, length 208
10:51:41.694240 IP 172.16.7.248.2152 > 172.16.5.18.2152: UDP, length 208
10:51:41.694241 IP 172.16.7.248.2152 > 172.16.5.18.2152: UDP, length 208
10:51:41.734265 IP 172.16.7.248.2152 > 172.16.5.18.2152: UDP, length 208
10:51:41.734266 IP 172.16.7.248.2152 > 172.16.5.18.2152: UDP, length 208
10:51:41.774294 IP 172.16.7.248.2152 > 172.16.5.18.2152: UDP, length 208
10:51:41.774296 IP 172.16.7.248.2152 > 172.16.5.18.2152: UDP, length 208
10:51:41.814230 IP 172.16.7.248.2152 > 172.16.5.18.2152: UDP, length 208
10:51:41.814232 IP 172.16.7.248.2152 > 172.16.5.18.2152: UDP, length 208
10:51:41.854237 IP 172.16.7.248.2152 > 172.16.5.18.2152: UDP, length 208
10:51:41.854238 IP 172.16.7.248.2152 > 172.16.5.18.2152: UDP, length 208
10:51:41.874298 IP 172.16.7.248.2152 > 172.16.5.18.2152: UDP, length 56
10:51:41.874388 IP 172.16.5.18.2152 > 172.16.7.248.2152: UDP, length 84
10:51:41.874415 IP 172.16.5.18.2152 > 172.16.7.248.2152: UDP, length 56
10:51:41.884387 IP 172.16.7.248.2152 > 172.16.5.18.2152: UDP, length 56
10:51:41.884443 IP 172.16.5.18.2152 > 172.16.7.248.2152: UDP, length 56
10:51:41.894247 IP 172.16.7.248.2152 > 172.16.5.18.2152: UDP, length 208
10:51:41.894248 IP 172.16.7.248.2152 > 172.16.5.18.2152: UDP, length 208
10:51:41.934281 IP 172.16.7.248.2152 > 172.16.5.18.2152: UDP, length 208
10:51:41.934282 IP 172.16.7.248.2152 > 172.16.5.18.2152: UDP, length 84
10:51:41.934385 IP 172.16.5.18.2152 > 172.16.7.248.2152: UDP, length 84
10:51:41.934400 IP 172.16.7.248.2152 > 172.16.5.18.2152: UDP, length 208
10:51:41.974279 IP 172.16.7.248.2152 > 172.16.5.18.2152: UDP, length 208
10:51:41.974280 IP 172.16.7.248.2152 > 172.16.5.18.2152: UDP, length 168
10:51:41.974357 IP 172.16.7.248.2152 > 172.16.5.18.2152: UDP, length 208
10:51:41.974376 IP 172.16.7.248.2152 > 172.16.5.18.2152: UDP, length 56
10:51:42.014258 IP 172.16.7.248.2152 > 172.16.5.18.2152: UDP, length 208
10:51:42.014259 IP 172.16.7.248.2152 > 172.16.5.18.2152: UDP, length 208
10:51:42.054231 IP 172.16.7.248.2152 > 172.16.5.18.2152: UDP, length 208
10:51:42.054232 IP 172.16.7.248.2152 > 172.16.5.18.2152: UDP, length 208
10:51:42.094214 IP 172.16.7.248.2152 > 172.16.5.18.2152: UDP, length 208
10:51:42.094215 IP 172.16.7.248.2152 > 172.16.5.18.2152: UDP, length 208
10:51:42.134257 IP 172.16.7.248.2152 > 172.16.5.18.2152: UDP, length 208
10:51:42.134258 IP 172.16.7.248.2152 > 172.16.5.18.2152: UDP, length 208
10:51:42.174229 IP 172.16.7.248.2152 > 172.16.5.18.2152: UDP, length 208
10:51:42.174230 IP 172.16.7.248.2152 > 172.16.5.18.2152: UDP, length 208
10:51:42.214233 IP 172.16.7.248.2152 > 172.16.5.18.2152: UDP, length 208
10:51:42.214234 IP 172.16.7.248.2152 > 172.16.5.18.2152: UDP, length 208
10:51:42.254283 IP 172.16.7.248.2152 > 172.16.5.18.2152: UDP, length 208
10:51:42.254284 IP 172.16.7.248.2152 > 172.16.5.18.2152: UDP, length 208
10:51:42.294255 IP 172.16.7.248.2152 > 172.16.5.18.2152: UDP, length 208
10:51:42.294256 IP 172.16.7.248.2152 > 172.16.5.18.2152: UDP, length 208
10:51:42.334239 IP 172.16.7.248.2152 > 172.16.5.18.2152: UDP, length 208
10:51:42.334241 IP 172.16.7.248.2152 > 172.16.5.18.2152: UDP, length 208
10:51:42.354247 IP 172.16.7.248.2152 > 172.16.5.18.2152: UDP, length 56
10:51:42.354294 IP 172.16.5.18.2152 > 172.16.7.248.2152: UDP, length 56
10:51:42.364325 IP 172.16.7.248.2152 > 172.16.5.18.2152: UDP, length 56
10:51:42.364367 IP 172.16.5.18.2152 > 172.16.7.248.2152: UDP, length 56
10:51:42.374383 IP 172.16.7.248.2152 > 172.16.5.18.2152: UDP, length 208
10:51:42.374384 IP 172.16.7.248.2152 > 172.16.5.18.2152: UDP, length 208
10:51:42.414253 IP 172.16.7.248.2152 > 172.16.5.18.2152: UDP, length 208
10:51:42.414254 IP 172.16.7.248.2152 > 172.16.5.18.2152: UDP, length 84
10:51:42.414344 IP 172.16.5.18.2152 > 172.16.7.248.2152: UDP, length 84
10:51:42.414359 IP 172.16.7.248.2152 > 172.16.5.18.2152: UDP, length 208
10:51:42.454253 IP 172.16.7.248.2152 > 172.16.5.18.2152: UDP, length 208
10:51:42.454255 IP 172.16.7.248.2152 > 172.16.5.18.2152: UDP, length 208
10:51:42.494266 IP 172.16.7.248.2152 > 172.16.5.18.2152: UDP, length 208
10:51:42.494267 IP 172.16.7.248.2152 > 172.16.5.18.2152: UDP, length 56
10:51:42.494370 IP 172.16.7.248.2152 > 172.16.5.18.2152: UDP, length 208
10:51:42.534244 IP 172.16.7.248.2152 > 172.16.5.18.2152: UDP, length 208
10:51:42.534245 IP 172.16.7.248.2152 > 172.16.5.18.2152: UDP, length 208
10:51:42.574244 IP 172.16.7.248.2152 > 172.16.5.18.2152: UDP, length 208
10:51:42.574245 IP 172.16.7.248.2152 > 172.16.5.18.2152: UDP, length 208
10:51:42.614268 IP 172.16.7.248.2152 > 172.16.5.18.2152: UDP, length 208
10:51:42.614270 IP 172.16.7.248.2152 > 172.16.5.18.2152: UDP, length 208
10:51:42.654246 IP 172.16.7.248.2152 > 172.16.5.18.2152: UDP, length 208
10:51:42.654247 IP 172.16.7.248.2152 > 172.16.5.18.2152: UDP, length 208
10:51:42.694271 IP 172.16.7.248.2152 > 172.16.5.18.2152: UDP, length 208
10:51:42.694272 IP 172.16.7.248.2152 > 172.16.5.18.2152: UDP, length 208
10:51:42.734283 IP 172.16.7.248.2152 > 172.16.5.18.2152: UDP, length 208
10:51:42.734284 IP 172.16.7.248.2152 > 172.16.5.18.2152: UDP, length 208
10:51:42.774267 IP 172.16.7.248.2152 > 172.16.5.18.2152: UDP, length 208
10:51:42.774268 IP 172.16.7.248.2152 > 172.16.5.18.2152: UDP, length 208
10:51:42.814236 IP 172.16.7.248.2152 > 172.16.5.18.2152: UDP, length 208
10:51:42.814238 IP 172.16.7.248.2152 > 172.16.5.18.2152: UDP, length 208
10:51:42.854245 IP 172.16.7.248.2152 > 172.16.5.18.2152: UDP, length 56
10:51:42.854246 IP 172.16.7.248.2152 > 172.16.5.18.2152: UDP, length 208
10:51:42.854330 IP 172.16.5.18.2152 > 172.16.7.248.2152: UDP, length 84
10:51:42.854358 IP 172.16.5.18.2152 > 172.16.7.248.2152: UDP, length 56
10:51:42.854392 IP 172.16.7.248.2152 > 172.16.5.18.2152: UDP, length 208
10:51:42.864258 IP 172.16.7.248.2152 > 172.16.5.18.2152: UDP, length 56
10:51:42.864308 IP 172.16.5.18.2152 > 172.16.7.248.2152: UDP, length 56
10:51:42.894232 IP 172.16.7.248.2152 > 172.16.5.18.2152: UDP, length 208
10:51:42.894297 IP 172.16.7.248.2152 > 172.16.5.18.2152: UDP, length 208
10:51:42.894298 IP 172.16.7.248.2152 > 172.16.5.18.2152: UDP, length 84
10:51:42.894348 IP 172.16.5.18.2152 > 172.16.7.248.2152: UDP, length 84
10:51:42.934214 IP 172.16.7.248.2152 > 172.16.5.18.2152: UDP, length 208
10:51:42.934215 IP 172.16.7.248.2152 > 172.16.5.18.2152: UDP, length 208
10:51:42.974290 IP 172.16.7.248.2152 > 172.16.5.18.2152: UDP, length 208
10:51:42.984243 IP 172.16.7.248.2152 > 172.16.5.18.2152: UDP, length 208
10:51:42.994236 IP 172.16.7.248.2152 > 172.16.5.18.2152: UDP, length 208
10:51:43.004225 IP 172.16.7.248.2152 > 172.16.5.18.2152: UDP, length 56
10:51:43.014248 IP 172.16.7.248.2152 > 172.16.5.18.2152: UDP, length 208
10:51:43.054279 IP 172.16.7.248.2152 > 172.16.5.18.2152: UDP, length 208
10:51:43.054280 IP 172.16.7.248.2152 > 172.16.5.18.2152: UDP, length 208
10:51:43.094221 IP 172.16.7.248.2152 > 172.16.5.18.2152: UDP, length 208
10:51:43.094223 IP 172.16.7.248.2152 > 172.16.5.18.2152: UDP, length 208
10:51:43.134215 IP 172.16.7.248.2152 > 172.16.5.18.2152: UDP, length 208
10:51:43.134216 IP 172.16.7.248.2152 > 172.16.5.18.2152: UDP, length 208
10:51:43.174264 IP 172.16.7.248.2152 > 172.16.5.18.2152: UDP, length 208
10:51:43.174265 IP 172.16.7.248.2152 > 172.16.5.18.2152: UDP, length 208
10:51:43.214270 IP 172.16.7.248.2152 > 172.16.5.18.2152: UDP, length 208
10:51:43.214271 IP 172.16.7.248.2152 > 172.16.5.18.2152: UDP, length 208
10:51:43.254253 IP 172.16.7.248.2152 > 172.16.5.18.2152: UDP, length 208
10:51:43.254254 IP 172.16.7.248.2152 > 172.16.5.18.2152: UDP, length 208
10:51:43.294269 IP 172.16.7.248.2152 > 172.16.5.18.2152: UDP, length 208
10:51:43.294270 IP 172.16.7.248.2152 > 172.16.5.18.2152: UDP, length 208
10:51:43.334228 IP 172.16.7.248.2152 > 172.16.5.18.2152: UDP, length 208
10:51:43.334229 IP 172.16.7.248.2152 > 172.16.5.18.2152: UDP, length 208
10:51:43.354207 IP 172.16.7.248.2152 > 172.16.5.18.2152: UDP, length 56
10:51:43.354266 IP 172.16.5.18.2152 > 172.16.7.248.2152: UDP, length 56
10:51:43.364274 IP 172.16.7.248.2152 > 172.16.5.18.2152: UDP, length 56
10:51:43.364324 IP 172.16.5.18.2152 > 172.16.7.248.2152: UDP, length 56
10:51:43.374274 IP 172.16.7.248.2152 > 172.16.5.18.2152: UDP, length 208
10:51:43.374275 IP 172.16.7.248.2152 > 172.16.5.18.2152: UDP, length 208
10:51:43.414222 IP 172.16.7.248.2152 > 172.16.5.18.2152: UDP, length 208
10:51:43.414223 IP 172.16.7.248.2152 > 172.16.5.18.2152: UDP, length 84
10:51:43.414375 IP 172.16.5.18.2152 > 172.16.7.248.2152: UDP, length 84
10:51:43.414394 IP 172.16.7.248.2152 > 172.16.5.18.2152: UDP, length 208
10:51:43.454228 IP 172.16.7.248.2152 > 172.16.5.18.2152: UDP, length 208
10:51:43.454229 IP 172.16.7.248.2152 > 172.16.5.18.2152: UDP, length 208
10:51:43.494199 IP 172.16.7.248.2152 > 172.16.5.18.2152: UDP, length 208
10:51:43.494200 IP 172.16.7.248.2152 > 172.16.5.18.2152: UDP, length 208
10:51:43.494246 IP 172.16.7.248.2152 > 172.16.5.18.2152: UDP, length 56
10:51:43.534233 IP 172.16.7.248.2152 > 172.16.5.18.2152: UDP, length 208
10:51:43.534234 IP 172.16.7.248.2152 > 172.16.5.18.2152: UDP, length 208
10:51:43.574212 IP 172.16.7.248.2152 > 172.16.5.18.2152: UDP, length 208
10:51:43.574213 IP 172.16.7.248.2152 > 172.16.5.18.2152: UDP, length 208
10:51:43.614252 IP 172.16.7.248.2152 > 172.16.5.18.2152: UDP, length 208
10:51:43.614253 IP 172.16.7.248.2152 > 172.16.5.18.2152: UDP, length 208
10:51:43.654226 IP 172.16.7.248.2152 > 172.16.5.18.2152: UDP, length 208
10:51:43.654227 IP 172.16.7.248.2152 > 172.16.5.18.2152: UDP, length 208
10:51:43.694211 IP 172.16.7.248.2152 > 172.16.5.18.2152: UDP, length 208
10:51:43.694251 IP 172.16.7.248.2152 > 172.16.5.18.2152: UDP, length 208
10:51:43.734210 IP 172.16.7.248.2152 > 172.16.5.18.2152: UDP, length 208
10:51:43.734212 IP 172.16.7.248.2152 > 172.16.5.18.2152: UDP, length 208
10:51:43.774202 IP 172.16.7.248.2152 > 172.16.5.18.2152: UDP, length 208
10:51:43.774203 IP 172.16.7.248.2152 > 172.16.5.18.2152: UDP, length 208
10:51:43.814191 IP 172.16.7.248.2152 > 172.16.5.18.2152: UDP, length 208
10:51:43.814250 IP 172.16.7.248.2152 > 172.16.5.18.2152: UDP, length 208
10:51:43.854206 IP 172.16.7.248.2152 > 172.16.5.18.2152: UDP, length 208
10:51:43.854207 IP 172.16.7.248.2152 > 172.16.5.18.2152: UDP, length 208
10:51:43.874357 IP 172.16.7.248.2152 > 172.16.5.18.2152: UDP, length 56
10:51:43.874427 IP 172.16.5.18.2152 > 172.16.7.248.2152: UDP, length 56
10:51:43.884327 IP 172.16.7.248.2152 > 172.16.5.18.2152: UDP, length 56
10:51:43.884378 IP 172.16.5.18.2152 > 172.16.7.248.2152: UDP, length 56
10:51:43.894308 IP 172.16.7.248.2152 > 172.16.5.18.2152: UDP, length 208
10:51:43.894309 IP 172.16.7.248.2152 > 172.16.5.18.2152: UDP, length 208
10:51:43.934253 IP 172.16.7.248.2152 > 172.16.5.18.2152: UDP, length 208
10:51:43.934254 IP 172.16.7.248.2152 > 172.16.5.18.2152: UDP, length 84
10:51:43.934350 IP 172.16.5.18.2152 > 172.16.7.248.2152: UDP, length 84
10:51:43.934366 IP 172.16.7.248.2152 > 172.16.5.18.2152: UDP, length 208
10:51:43.974237 IP 172.16.7.248.2152 > 172.16.5.18.2152: UDP, length 208
10:51:43.974239 IP 172.16.7.248.2152 > 172.16.5.18.2152: UDP, length 208
10:51:44.014227 IP 172.16.7.248.2152 > 172.16.5.18.2152: UDP, length 208
10:51:44.014228 IP 172.16.7.248.2152 > 172.16.5.18.2152: UDP, length 168
10:51:44.014303 IP 172.16.7.248.2152 > 172.16.5.18.2152: UDP, length 56
10:51:44.014304 IP 172.16.7.248.2152 > 172.16.5.18.2152: UDP, length 208
10:51:44.054222 IP 172.16.7.248.2152 > 172.16.5.18.2152: UDP, length 208
10:51:44.054223 IP 172.16.7.248.2152 > 172.16.5.18.2152: UDP, length 208
10:51:44.094253 IP 172.16.7.248.2152 > 172.16.5.18.2152: UDP, length 208
10:51:44.094254 IP 172.16.7.248.2152 > 172.16.5.18.2152: UDP, length 208
10:51:44.124230 IP 172.16.7.248.2152 > 172.16.5.18.2152: UDP, length 208
10:51:44.134194 IP 172.16.7.248.2152 > 172.16.5.18.2152: UDP, length 208
10:51:44.164250 IP 172.16.7.248.2152 > 172.16.5.18.2152: UDP, length 208
10:51:44.174219 IP 172.16.7.248.2152 > 172.16.5.18.2152: UDP, length 208
10:51:44.204325 IP 172.16.7.248.2152 > 172.16.5.18.2152: UDP, length 208
10:51:44.214226 IP 172.16.7.248.2152 > 172.16.5.18.2152: UDP, length 208
10:51:44.244308 IP 172.16.7.248.2152 > 172.16.5.18.2152: UDP, length 208
10:51:44.254246 IP 172.16.7.248.2152 > 172.16.5.18.2152: UDP, length 208
10:51:44.284228 IP 172.16.7.248.2152 > 172.16.5.18.2152: UDP, length 208
10:51:44.294235 IP 172.16.7.248.2152 > 172.16.5.18.2152: UDP, length 208
10:51:44.324290 IP 172.16.7.248.2152 > 172.16.5.18.2152: UDP, length 208
10:51:44.334234 IP 172.16.7.248.2152 > 172.16.5.18.2152: UDP, length 208
10:51:44.364275 IP 172.16.7.248.2152 > 172.16.5.18.2152: UDP, length 208
10:51:44.374218 IP 172.16.7.248.2152 > 172.16.5.18.2152: UDP, length 208
10:51:44.394233 IP 172.16.7.248.2152 > 172.16.5.18.2152: UDP, length 56
10:51:44.394313 IP 172.16.5.18.2152 > 172.16.7.248.2152: UDP, length 84
10:51:44.394346 IP 172.16.5.18.2152 > 172.16.7.248.2152: UDP, length 56
10:51:44.404269 IP 172.16.7.248.2152 > 172.16.5.18.2152: UDP, length 56
10:51:44.404270 IP 172.16.7.248.2152 > 172.16.5.18.2152: UDP, length 208
10:51:44.404354 IP 172.16.5.18.2152 > 172.16.7.248.2152: UDP, length 56
10:51:44.414249 IP 172.16.7.248.2152 > 172.16.5.18.2152: UDP, length 208
10:51:44.444251 IP 172.16.7.248.2152 > 172.16.5.18.2152: UDP, length 208
10:51:44.454257 IP 172.16.7.248.2152 > 172.16.5.18.2152: UDP, length 208
10:51:44.484349 IP 172.16.7.248.2152 > 172.16.5.18.2152: UDP, length 208
10:51:44.494214 IP 172.16.7.248.2152 > 172.16.5.18.2152: UDP, length 208
10:51:44.504234 IP 172.16.7.248.2152 > 172.16.5.18.2152: UDP, length 56
10:51:44.514218 IP 172.16.7.248.2152 > 172.16.5.18.2152: UDP, length 208
10:51:44.544298 IP 172.16.7.248.2152 > 172.16.5.18.2152: UDP, length 208
10:51:44.554227 IP 172.16.7.248.2152 > 172.16.5.18.2152: UDP, length 208
10:51:44.584325 IP 172.16.7.248.2152 > 172.16.5.18.2152: UDP, length 208
10:51:44.594221 IP 172.16.7.248.2152 > 172.16.5.18.2152: UDP, length 208
10:51:44.624304 IP 172.16.7.248.2152 > 172.16.5.18.2152: UDP, length 208
10:51:44.634238 IP 172.16.7.248.2152 > 172.16.5.18.2152: UDP, length 208
10:51:44.664249 IP 172.16.7.248.2152 > 172.16.5.18.2152: UDP, length 208
10:51:44.674224 IP 172.16.7.248.2152 > 172.16.5.18.2152: UDP, length 208
10:51:44.704294 IP 172.16.7.248.2152 > 172.16.5.18.2152: UDP, length 208
10:51:44.714210 IP 172.16.7.248.2152 > 172.16.5.18.2152: UDP, length 208
10:51:44.744270 IP 172.16.7.248.2152 > 172.16.5.18.2152: UDP, length 208
10:51:44.754216 IP 172.16.7.248.2152 > 172.16.5.18.2152: UDP, length 208
10:51:44.784272 IP 172.16.7.248.2152 > 172.16.5.18.2152: UDP, length 208
10:51:44.794222 IP 172.16.7.248.2152 > 172.16.5.18.2152: UDP, length 208
10:51:44.824277 IP 172.16.7.248.2152 > 172.16.5.18.2152: UDP, length 208
10:51:44.834215 IP 172.16.7.248.2152 > 172.16.5.18.2152: UDP, length 208
10:51:44.864241 IP 172.16.7.248.2152 > 172.16.5.18.2152: UDP, length 208
10:51:44.874290 IP 172.16.7.248.2152 > 172.16.5.18.2152: UDP, length 208
10:51:44.894206 IP 172.16.7.248.2152 > 172.16.5.18.2152: UDP, length 56
10:51:44.894276 IP 172.16.5.18.2152 > 172.16.7.248.2152: UDP, length 56
10:51:44.904288 IP 172.16.7.248.2152 > 172.16.5.18.2152: UDP, length 56
10:51:44.904289 IP 172.16.7.248.2152 > 172.16.5.18.2152: UDP, length 208
10:51:44.904353 IP 172.16.5.18.2152 > 172.16.7.248.2152: UDP, length 56
10:51:44.914257 IP 172.16.7.248.2152 > 172.16.5.18.2152: UDP, length 208
10:51:44.944230 IP 172.16.7.248.2152 > 172.16.5.18.2152: UDP, length 208
10:51:44.954235 IP 172.16.7.248.2152 > 172.16.5.18.2152: UDP, length 84
10:51:44.954236 IP 172.16.7.248.2152 > 172.16.5.18.2152: UDP, length 208
10:51:44.954296 IP 172.16.5.18.2152 > 172.16.7.248.2152: UDP, length 84
10:51:44.984252 IP 172.16.7.248.2152 > 172.16.5.18.2152: UDP, length 208
10:51:44.994220 IP 172.16.7.248.2152 > 172.16.5.18.2152: UDP, length 208
10:51:45.004217 IP 172.16.7.248.2152 > 172.16.5.18.2152: UDP, length 56
10:51:45.014250 IP 172.16.7.248.2152 > 172.16.5.18.2152: UDP, length 208
10:51:45.044324 IP 172.16.7.248.2152 > 172.16.5.18.2152: UDP, length 208
10:51:45.054208 IP 172.16.7.248.2152 > 172.16.5.18.2152: UDP, length 208
10:51:45.084313 IP 172.16.7.248.2152 > 172.16.5.18.2152: UDP, length 208
10:51:45.094227 IP 172.16.7.248.2152 > 172.16.5.18.2152: UDP, length 208
10:51:45.104213 IP 172.16.7.248.2152 > 172.16.5.18.2152: UDP, length 92
10:51:45.124259 IP 172.16.7.248.2152 > 172.16.5.18.2152: UDP, length 208
10:51:45.134221 IP 172.16.7.248.2152 > 172.16.5.18.2152: UDP, length 208
10:51:45.164316 IP 172.16.7.248.2152 > 172.16.5.18.2152: UDP, length 208
10:51:45.174209 IP 172.16.7.248.2152 > 172.16.5.18.2152: UDP, length 208
10:51:45.204247 IP 172.16.7.248.2152 > 172.16.5.18.2152: UDP, length 208
10:51:45.214228 IP 172.16.7.248.2152 > 172.16.5.18.2152: UDP, length 208
10:51:45.244283 IP 172.16.7.248.2152 > 172.16.5.18.2152: UDP, length 208
10:51:45.254219 IP 172.16.7.248.2152 > 172.16.5.18.2152: UDP, length 208
10:51:45.284312 IP 172.16.7.248.2152 > 172.16.5.18.2152: UDP, length 208
10:51:45.294204 IP 172.16.7.248.2152 > 172.16.5.18.2152: UDP, length 208
10:51:45.324310 IP 172.16.7.248.2152 > 172.16.5.18.2152: UDP, length 208
10:51:45.334222 IP 172.16.7.248.2152 > 172.16.5.18.2152: UDP, length 208
10:51:45.364243 IP 172.16.7.248.2152 > 172.16.5.18.2152: UDP, length 208
10:51:45.374204 IP 172.16.7.248.2152 > 172.16.5.18.2152: UDP, length 56
10:51:45.374205 IP 172.16.7.248.2152 > 172.16.5.18.2152: UDP, length 208
10:51:45.374276 IP 172.16.5.18.2152 > 172.16.7.248.2152: UDP, length 56
10:51:45.384269 IP 172.16.7.248.2152 > 172.16.5.18.2152: UDP, length 56
10:51:45.384320 IP 172.16.5.18.2152 > 172.16.7.248.2152: UDP, length 56
10:51:45.404235 IP 172.16.7.248.2152 > 172.16.5.18.2152: UDP, length 208
10:51:45.414206 IP 172.16.7.248.2152 > 172.16.5.18.2152: UDP, length 208
10:51:45.444240 IP 172.16.7.248.2152 > 172.16.5.18.2152: UDP, length 208
10:51:45.454206 IP 172.16.7.248.2152 > 172.16.5.18.2152: UDP, length 208
10:51:45.484230 IP 172.16.7.248.2152 > 172.16.5.18.2152: UDP, length 208
10:51:45.494202 IP 172.16.7.248.2152 > 172.16.5.18.2152: UDP, length 208
10:51:45.494203 IP 172.16.7.248.2152 > 172.16.5.18.2152: UDP, length 56
10:51:45.524237 IP 172.16.7.248.2152 > 172.16.5.18.2152: UDP, length 208
10:51:45.534209 IP 172.16.7.248.2152 > 172.16.5.18.2152: UDP, length 208
10:51:45.564270 IP 172.16.7.248.2152 > 172.16.5.18.2152: UDP, length 208
10:51:45.574210 IP 172.16.7.248.2152 > 172.16.5.18.2152: UDP, length 208
10:51:45.604246 IP 172.16.7.248.2152 > 172.16.5.18.2152: UDP, length 208
10:51:45.614226 IP 172.16.7.248.2152 > 172.16.5.18.2152: UDP, length 208
10:51:45.644291 IP 172.16.7.248.2152 > 172.16.5.18.2152: UDP, length 208
10:51:45.654214 IP 172.16.7.248.2152 > 172.16.5.18.2152: UDP, length 208
10:51:45.684311 IP 172.16.7.248.2152 > 172.16.5.18.2152: UDP, length 208
10:51:45.694196 IP 172.16.7.248.2152 > 172.16.5.18.2152: UDP, length 208
10:51:45.724293 IP 172.16.7.248.2152 > 172.16.5.18.2152: UDP, length 208
10:51:45.734186 IP 172.16.7.248.2152 > 172.16.5.18.2152: UDP, length 208
10:51:45.764246 IP 172.16.7.248.2152 > 172.16.5.18.2152: UDP, length 208
10:51:45.774230 IP 172.16.7.248.2152 > 172.16.5.18.2152: UDP, length 208
10:51:45.804320 IP 172.16.7.248.2152 > 172.16.5.18.2152: UDP, length 208
10:51:45.814243 IP 172.16.7.248.2152 > 172.16.5.18.2152: UDP, length 208
10:51:45.844281 IP 172.16.7.248.2152 > 172.16.5.18.2152: UDP, length 208
10:51:45.854225 IP 172.16.7.248.2152 > 172.16.5.18.2152: UDP, length 56
10:51:45.854226 IP 172.16.7.248.2152 > 172.16.5.18.2152: UDP, length 208
10:51:45.854298 IP 172.16.5.18.2152 > 172.16.7.248.2152: UDP, length 56
10:51:45.864273 IP 172.16.7.248.2152 > 172.16.5.18.2152: UDP, length 56
10:51:45.864324 IP 172.16.5.18.2152 > 172.16.7.248.2152: UDP, length 56
10:51:45.884403 IP 172.16.7.248.2152 > 172.16.5.18.2152: UDP, length 208
10:51:45.894217 IP 172.16.7.248.2152 > 172.16.5.18.2152: UDP, length 208
10:51:45.894219 IP 172.16.7.248.2152 > 172.16.5.18.2152: UDP, length 84
10:51:45.894304 IP 172.16.5.18.2152 > 172.16.7.248.2152: UDP, length 84
10:51:45.924462 IP 172.16.7.248.2152 > 172.16.5.18.2152: UDP, length 208
10:51:45.934279 IP 172.16.7.248.2152 > 172.16.5.18.2152: UDP, length 208
10:51:45.964295 IP 172.16.7.248.2152 > 172.16.5.18.2152: UDP, length 208
10:51:45.974246 IP 172.16.7.248.2152 > 172.16.5.18.2152: UDP, length 208
10:51:46.004323 IP 172.16.7.248.2152 > 172.16.5.18.2152: UDP, length 208
10:51:46.004324 IP 172.16.7.248.2152 > 172.16.5.18.2152: UDP, length 56
10:51:46.014215 IP 172.16.7.248.2152 > 172.16.5.18.2152: UDP, length 208
10:51:46.044240 IP 172.16.7.248.2152 > 172.16.5.18.2152: UDP, length 208
10:51:46.054199 IP 172.16.7.248.2152 > 172.16.5.18.2152: UDP, length 208
